{
  "keymapId": "mouse_left",
  "kind": "single",
  "description": "左クリック1つだけの部品。トラックボールの隣に置いて使う。\n\n■ なぜ1キーで1部品なのか\n区画（section）は部品1つを丸ごと置く単位なので、「1マスにボタン1つ」を試すには『キーが1つしかない盤面』を部品として作るのが素直。右クリックは mouse_right として別部品にしてある。2つを別の区画に置けるので、位置も大きさも別々に決められる。\n\n■ トラックボールのタップとの違い\nトラックボール面はすでに1本タップ＝左クリック、2本タップ＝右クリックを持っている（surfaces/trackball.json の gestures）。こちらは『押す場所が目に見えるボタン』が欲しいときの選択肢で、どちらか一方に統一する必要はない。\n\n■ 送るもの\nmouse.click は押した瞬間（down）に1回だけ発火する。押しっぱなしのドラッグはこの部品では出来ない（それはトラックボール面の hold1 が受け持つ）。",
  "board": {
    "cols": 1,
    "keys": [
      { "col": 1, "id": "ML", "row": 1 },
      { "col": 1, "id": "K201", "row": 2 },
      { "col": 1, "id": "K301", "row": 3 }
    ]
  },
  "layerFiles": [
    "layers/mouse_left_layer0.json"
  ]
}
