{
  "keymapId": "appswitch",
  "kind": "single",
  "description": "アプリ切り替えボタン。押すと『そのアプリを前に出す』と『そのアプリ用のboardへ移る』をまとめてやる。\n\n■ Hubは画面を見ていない\n前面のアプリをHubが監視する作りにはしていない。**人が押した時だけ**動くので、Hubはあなたが今何を使っているかを一切知らない。\n\n■ Win+数字はタスクバーの順番\nfire に入れている Win+1 などは『タスクバーの左から何番目を開くか』。並べ替えると行き先も変わるので、タスクバー側を固定してから割り当てること。\n\n■ 戻る\n『既定へ戻る』は layout.switch の id を省くと、Hubが決めた既定のboardへ戻る。\n\n■ A3 Note Story 起動（2026-10-01・REQ-20261001-001）\nPC で Note Story（PWA）を開き、起動できたら押した端末の盤面を note_story へ移す（Hooks: app.launch の fire に layout.switch）。起動に失敗したら盤面は移らない。移るのは押した端末だけ（to: all は付けていない）。",
  "board": {
    "cols": 3,
    "keys": [
      {
        "id": "A1",
        "row": 1,
        "col": 1
      },
      {
        "id": "A2",
        "row": 1,
        "col": 2
      },
      {
        "id": "A3",
        "row": 1,
        "col": 3
      }
    ]
  },
  "layerFiles": [
    "layers/appswitch_layer0.json"
  ]
}
