{
  "keymapId": "ipad01_vol12",
  "kind": "single",
  "description": "iPad Pro 12.9(第3世代)一枚キーボード Vol1.2（T8）。**配置の正は2026-09-05のユーザー指示（brief/spec_return_log.md SR-003）**。brief/mockup/screen_mock_v0.4.html は row2-5 について古い（1列右寄りのまま）ので参照しないこと。D24: boardは13列グリッド式（row/col/colSpan/rowSpan、span省略時1）。keyIdはK+行+列2桁で位置と一致する（例K202=row2 col2）。ヘッダ専用のCTRL+Z/CTRL+Y(取り消し/進む)はH01/H02、レイヤーバッジ長押しはH03としてboard外＝layerFilesのkeys側にのみ定義する。",
  "board": {
    "cols": 13,
    "keys": [
      {"id": "K101", "row": 1, "col": 1},
      {"id": "K102", "row": 1, "col": 2},
      {"id": "K103", "row": 1, "col": 3},
      {"id": "K104", "row": 1, "col": 4},
      {"id": "K105", "row": 1, "col": 5},
      {"id": "K106", "row": 1, "col": 6},
      {"id": "K107", "row": 1, "col": 7},
      {"id": "K108", "row": 1, "col": 8},
      {"id": "K109", "row": 1, "col": 9},
      {"id": "K110", "row": 1, "col": 10},
      {"id": "K111", "row": 1, "col": 11},
      {"id": "K112", "row": 1, "col": 12},
      {"id": "K113", "row": 1, "col": 13},

      {"id": "K201", "row": 2, "col": 1},
      {"id": "K202", "row": 2, "col": 2},
      {"id": "K203", "row": 2, "col": 3},
      {"id": "K204", "row": 2, "col": 4},
      {"id": "K205", "row": 2, "col": 5},
      {"id": "K206", "row": 2, "col": 6},
      {"id": "K207", "row": 2, "col": 7},
      {"id": "K208", "row": 2, "col": 8},
      {"id": "K209", "row": 2, "col": 9},
      {"id": "K210", "row": 2, "col": 10},
      {"id": "K211", "row": 2, "col": 11},
      {"id": "K212", "row": 2, "col": 12},
      {"id": "K213", "row": 2, "col": 13, "rowSpan": 2},

      {"id": "K301", "row": 3, "col": 1},
      {"id": "K302", "row": 3, "col": 2},
      {"id": "K303", "row": 3, "col": 3},
      {"id": "K304", "row": 3, "col": 4},
      {"id": "K305", "row": 3, "col": 5},
      {"id": "K306", "row": 3, "col": 6},
      {"id": "K307", "row": 3, "col": 7},
      {"id": "K308", "row": 3, "col": 8},
      {"id": "K309", "row": 3, "col": 9},
      {"id": "K310", "row": 3, "col": 10},
      {"id": "K311", "row": 3, "col": 11},
      {"id": "K312", "row": 3, "col": 12},

      {"id": "K401", "row": 4, "col": 1},
      {"id": "K402", "row": 4, "col": 2},
      {"id": "K403", "row": 4, "col": 3},
      {"id": "K404", "row": 4, "col": 4},
      {"id": "K405", "row": 4, "col": 5},
      {"id": "K406", "row": 4, "col": 6},
      {"id": "K407", "row": 4, "col": 7},
      {"id": "K408", "row": 4, "col": 8},
      {"id": "K409", "row": 4, "col": 9},
      {"id": "K410", "row": 4, "col": 10},
      {"id": "K411", "row": 4, "col": 11},
      {"id": "K412", "row": 4, "col": 12},
      {"id": "K413", "row": 4, "col": 13},

      {"id": "K501", "row": 5, "col": 1},
      {"id": "K502", "row": 5, "col": 2},
      {"id": "K503", "row": 5, "col": 3},
      {"id": "K504", "row": 5, "col": 4, "colSpan": 6},
      {"id": "K510", "row": 5, "col": 10},
      {"id": "K511", "row": 5, "col": 11},
      {"id": "K512", "row": 5, "col": 12},
      {"id": "K513", "row": 5, "col": 13}
    ]
  },
  "layerFiles": [
    "layers/ipad01_vol12_layer0.json",
    "layers/ipad01_vol12_layer1.json",
    "layers/ipad01_vol12_layer2.json",
    "layers/ipad01_vol12_layer3.json"
  ]
}
