{
  "keymapId": "game_action",
  "kind": "single",
  "description": "ゲーム用のアクションボタン（3列×2行）。移動は dpad01／dpad_arrows（どちらも矢印キー）が担当し、こちらは「手で押す操作」を持つ。\n\n■ 既定の割当（layer0。キー編集画面で差し替えられる）\n上段 決定・調べる E ／ ジャンプ SPACE ／ 攻撃 左クリック\n下段 ダッシュ SHIFT ／ しゃがむ CTRL ／ 取消 ESC\n\n■ 押しっぱなしにしてあるもの\nジャンプ・ダッシュ・しゃがむ は key.hold。指を置いている間ずっと押され続け、離すと離れる。\n「長押しで高く跳ぶ」「押している間だけ走る」がそのまま効く。\nE・ESC は1回押して離すだけ（key）。\n\n■ 自分のゲームで使うとき\nどのキーで何が起きるかはゲーム側の設定次第なので、合わないときはキー編集画面で\nこの6つを差し替える。盤面の形（3×2）はそのままでよい。",
  "board": {
    "cols": 3,
    "keys": [
      { "id": "GA1", "row": 1, "col": 1 },
      { "id": "GA2", "row": 1, "col": 2 },
      { "id": "GA3", "row": 1, "col": 3 },
      { "id": "GA4", "row": 2, "col": 1 },
      { "id": "GA5", "row": 2, "col": 2 },
      { "id": "GA6", "row": 2, "col": 3 }
    ]
  },
  "layerFiles": [
    "layers/game_action_layer0.json"
  ]
}
