{
  "keymapId": "writing01",
  "description": "作業用キーマップ（D10: 今後ここを改造していく。初期内容はdefaultと同一）",
  "kind": "split",
  "halves": {
    "left":  { "rows": [["L11","L12","L13","L14","L15","L16"],["L21","L22","L23","L24","L25","L26"],["L31","L32","L33","L34","L35","L36"],["L41","L42","L43","L44"]] },
    "right": { "rows": [["R11","R12","R13","R14","R15","R16"],["R21","R22","R23","R24","R25","R26"],["R31","R32","R33","R34","R35","R36"],["R41","R42","R43","R44","R45"]] }
  },
  "layerFiles": ["layers/writing01_layer0.json", "layers/writing01_layer1.json", "layers/writing01_layer2.json"]
}
