{
  "keymapId": "youtube01",
  "kind": "single",
  "description": "YouTube視聴用のボタン盤。ホイール（jog_frame）と組み合わせて使う。\n\n■ ここに置かないもの\nコマ送り・コマ戻しはホイールが持っているので、ボタン側には置かない。同じ操作が2箇所にあると、どちらを使えばよいか迷うだけで得がない。\nスクショは単体の部品（screenshot01）へ分けて、右クリックの隣に置いてある。\n\n■ フォーカスが要るもの・要らないもの\n- 要らない: 再生/一時停止（MEDIA_PLAY）。OS側の機能なのでどのウィンドウが前でも効く\n- 要る: 10秒送り/戻し（J/L）。YouTubeのページにフォーカスが無いと効かず、検索欄にフォーカスがあると文字が入力される",
  "board": {
    "cols": 3,
    "keys": [
      { "id": "Y101", "row": 1, "col": 1 },
      { "id": "Y102", "row": 1, "col": 2 },
      { "id": "Y103", "row": 1, "col": 3 }
    ]
  },
  "layerFiles": [
    "layers/youtube01_layer0.json"
  ]
}
