{
  "keymapId": "screenshot_region",
  "kind": "single",
  "description": "範囲を選んで撮るスクショ1つだけの部品。screenshot01（画面全体を1枚保存）と対になる。\n\n■ 送るもの\nWIN+SHIFT+S。Windowsの切り取り領域の選択が開き、画面が暗くなる。範囲はトラックボールの「✋つかむ」で囲む（つかむ → 球で動かす（指を離して持ち直してもよい） → 離す、で確定）。「タップ→すぐ触れて置く」でも押しっぱなしにできるが、間合い頼みで実機では成功しなかった。\nトラックボール Vol1.1（/trackball_v1_1）の「2本指長押し」は使わない。離したときに Ctrl+C まで送るので、撮った範囲がクリップボードで上書きされることがある（Vol2 にはこの操作自体が無い）。左クリック部品は押した瞬間に1回クリックするだけなので、ドラッグには使えない。\n\n■ 保存先が screenshot01 と違う\n選んだ範囲は**クリップボードに入るだけ**で、ファイルにはならない（通知を押すと切り取りツールで保存できる）。ファイルとして残したいときは screenshot01 を使う。",
  "board": {
    "cols": 1,
    "keys": [
      { "id": "SR", "row": 1, "col": 1 }
    ]
  },
  "layerFiles": [
    "layers/screenshot_region_layer0.json"
  ]
}
